{
  "schemaVersion": "SyntheticSourcePage.v1",
  "pageId": "page:synthetic:tls-traffic-management:001",
  "contractPackRef": "contract:source-pack:tls-traffic-management:v1",
  "sourceFamily": "tls_traffic_management",
  "pageNumber": 1,
  "totalPageCount": 2,
  "currentCursorRef": "cursor:synthetic:tls-traffic-management:start",
  "nextCursorRef": "cursor:synthetic:tls-traffic-management:after-page-1",
  "records": [
    {
      "sourceRecordId": "record:synthetic:tls-traffic-management:alpha",
      "recordType": "tls_endpoint",
      "observedAt": "2030-01-07T12:02:00Z",
      "attributes": {
        "endpointRef": "endpoint:synthetic:alpha:443",
        "deploymentRef": "deployment:synthetic:tls:alpha",
        "applicationRef": "asset:synthetic:application:edge-service",
        "regionRef": "region:synthetic:alpha",
        "port": 443,
        "minimumProtocol": "tls1.2",
        "certificateRef": "certificate:synthetic:shared-edge"
      }
    }
  ],
  "safety": {
    "synthetic": true,
    "independentlyAuthored": true,
    "rawProviderPayload": false,
    "containsCredentials": false,
    "containsPersonalData": false,
    "containsKeyMaterial": false
  }
}
